{"$schema":"https://json-schema.org/draft/2020-12/schema","$id":"ox-genesis-lore-1.schema.json","title":"OriginX Genesis Resonance, Glyph and Akashic Package","type":"object","additionalProperties":false,"required":["loreVersion","tokenId","resonance","glyph","akashic","packageHash"],"properties":{"loreVersion":{"const":"OX-GENESIS-LORE-1"},"tokenId":{"type":"integer","minimum":1,"maximum":1000},"resonance":{"type":"object","required":["resonanceVersion","resonanceId","resonanceSignature","resonanceClass","spectrum","primaryFrequency","secondaryFrequency","pulse","phaseDegrees","glyphSeed","interpretation"]},"glyph":{"type":"object","required":["glyphVersion","glyphSeed","geometry","svg","svgHash","manifestHash","watermarkRequired"]},"akashic":{"type":"object","required":["akashicVersion","tokenId","appendOnly","tamperEvident","events","headHash"]},"packageHash":{"type":"string","pattern":"^sha256:[0-9a-f]{64}$"}}}
