{"akashic":{"akashicVersion":"OX-AKASHIC-1","appendOnly":true,"events":[{"containsPII":false,"eventHash":"sha256:42c646990da2c9413eac3cb9980b1ed18b82be5f8b7acb2a31eb8fd326eb8345","eventType":"DNA_FORGED","lifecycleReference":"GENESIS-0010-EVENT-0001","payload":{"dnaHash":"sha256:eae4083d2c95aef416944807cd3248d25531398181d338a5c4c57cea264c6dbd"},"previousEventHash":null,"publicSafe":true,"sequence":1},{"containsPII":false,"eventHash":"sha256:24591743e38c34bc484df4eefe0c7348f53603940a6b0eece7106de54e4758e6","eventType":"NAME_ASSIGNED","lifecycleReference":"GENESIS-0010-EVENT-0002","payload":{"canonicalName":"Vyrnathos the Origin Seal","title":"Bearer of the Origin Seal"},"previousEventHash":"sha256:42c646990da2c9413eac3cb9980b1ed18b82be5f8b7acb2a31eb8fd326eb8345","publicSafe":true,"sequence":2},{"containsPII":false,"eventHash":"sha256:46354cfdc197e4fce4727f3d9a5f0e719324dcfb42355aa078b32588af743b55","eventType":"RESONANCE_CREATED","lifecycleReference":"GENESIS-0010-EVENT-0003","payload":{"resonanceId":"OX-RES-GENESIS-0010","resonanceSignature":"sha256:9b374bfd8ce61b406d14315f56695ea97822a1202800d6cc786ed912c7c5f49d"},"previousEventHash":"sha256:24591743e38c34bc484df4eefe0c7348f53603940a6b0eece7106de54e4758e6","publicSafe":true,"sequence":3},{"containsPII":false,"eventHash":"sha256:49158eb1ef4fd1767087a0e0a813506d17c3d8e096aa38393afe0c0a4c8b4d20","eventType":"RESONANCE_GLYPH_MANIFESTED","lifecycleReference":"GENESIS-0010-EVENT-0004","payload":{"manifestHash":"sha256:167ab298be9bcc49058d6c7154be6d54d48e458626e2e372b8296bcc0dd62a81","svgHash":"sha256:8b649fd2383a5b784fb8b4ae40ccca242d0515fb937d0d31469d0c71b8f1c3b7"},"previousEventHash":"sha256:46354cfdc197e4fce4727f3d9a5f0e719324dcfb42355aa078b32588af743b55","publicSafe":true,"sequence":4}],"headHash":"sha256:49158eb1ef4fd1767087a0e0a813506d17c3d8e096aa38393afe0c0a4c8b4d20","tamperEvident":true,"tokenId":10},"glyph":{"geometry":{"asymmetryIndex":0,"influenceTargets":["horn rhythm","wing geometry","energy topology","cracks","engravings","architecture","lighting patterns"],"rings":3,"rotationDegrees":40,"spokes":7},"glyphSeed":18395034676111962269,"glyphVersion":"OX-RESONANCE-GLYPH-1","manifestHash":"sha256:167ab298be9bcc49058d6c7154be6d54d48e458626e2e372b8296bcc0dd62a81","svg":"<svg xmlns=\"http://www.w3.org/2000/svg\" viewBox=\"0 0 256 256\" fill=\"none\" stroke=\"currentColor\" stroke-width=\"3\"><circle cx=\"128\" cy=\"128\" r=\"44\"/><circle cx=\"128\" cy=\"128\" r=\"64\"/><circle cx=\"128\" cy=\"128\" r=\"84\"/><line x1=\"128\" y1=\"128\" x2=\"128\" y2=\"24\" transform=\"rotate(40.000 128 128)\"/><line x1=\"128\" y1=\"128\" x2=\"128\" y2=\"24\" transform=\"rotate(91.429 128 128)\"/><line x1=\"128\" y1=\"128\" x2=\"128\" y2=\"24\" transform=\"rotate(142.857 128 128)\"/><line x1=\"128\" y1=\"128\" x2=\"128\" y2=\"24\" transform=\"rotate(194.286 128 128)\"/><line x1=\"128\" y1=\"128\" x2=\"128\" y2=\"24\" transform=\"rotate(245.714 128 128)\"/><line x1=\"128\" y1=\"128\" x2=\"128\" y2=\"24\" transform=\"rotate(297.143 128 128)\"/><line x1=\"128\" y1=\"128\" x2=\"128\" y2=\"24\" transform=\"rotate(348.571 128 128)\"/></svg>","svgHash":"sha256:8b649fd2383a5b784fb8b4ae40ccca242d0515fb937d0d31469d0c71b8f1c3b7","tokenId":10,"watermarkRequired":false},"loreVersion":"OX-GENESIS-LORE-1","packageHash":"sha256:879c490f0a30f671f4a06f993fe463829745930311423372b26d26cdd4dae9fb","resonance":{"glyphSeed":18395034676111962269,"interpretation":"Deterministic artistic and mathematical parameters; not a claim of spiritual, physical, or scientific energy.","phaseDegrees":40,"primaryFrequency":428,"pulse":11,"resonanceClass":"CHTHONIC","resonanceId":"OX-RES-GENESIS-0010","resonanceSignature":"sha256:9b374bfd8ce61b406d14315f56695ea97822a1202800d6cc786ed912c7c5f49d","resonanceVersion":"OX-RESONANCE-1","secondaryFrequency":530,"spectrum":["mineral-cyan","weathered-stone","deep-black"]},"tokenId":10}