{"akashic":{"akashicVersion":"OX-AKASHIC-1","appendOnly":true,"events":[{"containsPII":false,"eventHash":"sha256:0e198792814364d08daadae06cf3439b457bc39ef16b593dd143faf6fa516544","eventType":"DNA_FORGED","lifecycleReference":"GENESIS-0001-EVENT-0001","payload":{"dnaHash":"sha256:c775e62b4bdd2feee5c587f4c8cd227a7d374b7121937194a9cf902d7efafe53"},"previousEventHash":null,"publicSafe":true,"sequence":1},{"containsPII":false,"eventHash":"sha256:5a3f97f03962e074c23629fa99fee7f4ab302231649b92b046822ff112c5e7f3","eventType":"NAME_ASSIGNED","lifecycleReference":"GENESIS-0001-EVENT-0002","payload":{"canonicalName":"Azhurak Primordialis","title":"The Primordial Witness"},"previousEventHash":"sha256:0e198792814364d08daadae06cf3439b457bc39ef16b593dd143faf6fa516544","publicSafe":true,"sequence":2},{"containsPII":false,"eventHash":"sha256:32b000e1d7e4b23e29cd679f1f47c4846bd777df40d106c389f0b76b19f09707","eventType":"RESONANCE_CREATED","lifecycleReference":"GENESIS-0001-EVENT-0003","payload":{"resonanceId":"OX-RES-GENESIS-0001","resonanceSignature":"sha256:66f2c3015b51ec76657902ca5f03d6fa1a34662d874c98bb5dc4f22f71b679c6"},"previousEventHash":"sha256:5a3f97f03962e074c23629fa99fee7f4ab302231649b92b046822ff112c5e7f3","publicSafe":true,"sequence":3},{"containsPII":false,"eventHash":"sha256:a777443cc20bf89190696b741546287d50f2b6c36617b3390bb80865d4676059","eventType":"RESONANCE_GLYPH_MANIFESTED","lifecycleReference":"GENESIS-0001-EVENT-0004","payload":{"manifestHash":"sha256:62599fc9b92ffcb346f1d2b8d421604ec5898dc3a82e1a155460c611bf0cef2b","svgHash":"sha256:0a98e7baa09b6d4a3592921fbf91cb7df85cd0185537cb6dcb6b4804bd361131"},"previousEventHash":"sha256:32b000e1d7e4b23e29cd679f1f47c4846bd777df40d106c389f0b76b19f09707","publicSafe":true,"sequence":4}],"headHash":"sha256:a777443cc20bf89190696b741546287d50f2b6c36617b3390bb80865d4676059","tamperEvident":true,"tokenId":1},"glyph":{"geometry":{"asymmetryIndex":2,"influenceTargets":["horn rhythm","wing geometry","energy topology","cracks","engravings","architecture","lighting patterns"],"rings":2,"rotationDegrees":19,"spokes":8},"glyphSeed":3564647988482742983,"glyphVersion":"OX-RESONANCE-GLYPH-1","manifestHash":"sha256:62599fc9b92ffcb346f1d2b8d421604ec5898dc3a82e1a155460c611bf0cef2b","svg":"<svg xmlns=\"http://www.w3.org/2000/svg\" viewBox=\"0 0 256 256\" fill=\"none\" stroke=\"currentColor\" stroke-width=\"3\"><circle cx=\"128\" cy=\"128\" r=\"44\"/><circle cx=\"128\" cy=\"128\" r=\"64\"/><line x1=\"128\" y1=\"128\" x2=\"128\" y2=\"24\" transform=\"rotate(19.000 128 128)\"/><line x1=\"128\" y1=\"128\" x2=\"128\" y2=\"24\" transform=\"rotate(64.000 128 128)\"/><line x1=\"128\" y1=\"128\" x2=\"128\" y2=\"24\" transform=\"rotate(109.000 128 128)\"/><line x1=\"128\" y1=\"128\" x2=\"128\" y2=\"24\" transform=\"rotate(154.000 128 128)\"/><line x1=\"128\" y1=\"128\" x2=\"128\" y2=\"24\" transform=\"rotate(199.000 128 128)\"/><line x1=\"128\" y1=\"128\" x2=\"128\" y2=\"24\" transform=\"rotate(244.000 128 128)\"/><line x1=\"128\" y1=\"128\" x2=\"128\" y2=\"24\" transform=\"rotate(289.000 128 128)\"/><line x1=\"128\" y1=\"128\" x2=\"128\" y2=\"24\" transform=\"rotate(334.000 128 128)\"/></svg>","svgHash":"sha256:0a98e7baa09b6d4a3592921fbf91cb7df85cd0185537cb6dcb6b4804bd361131","tokenId":1,"watermarkRequired":false},"loreVersion":"OX-GENESIS-LORE-1","packageHash":"sha256:cf7a12bb2459267d4a30f632c182cd10e7b178dc094ed43b0444df667da1d693","resonance":{"glyphSeed":3564647988482742983,"interpretation":"Deterministic artistic and mathematical parameters; not a claim of spiritual, physical, or scientific energy.","phaseDegrees":19,"primaryFrequency":359,"pulse":12,"resonanceClass":"MONOLITHIC","resonanceId":"OX-RES-GENESIS-0001","resonanceSignature":"sha256:66f2c3015b51ec76657902ca5f03d6fa1a34662d874c98bb5dc4f22f71b679c6","resonanceVersion":"OX-RESONANCE-1","secondaryFrequency":743,"spectrum":["deep-cyan","obsidian-black","mineral-white"]},"tokenId":1}