{"akashic":{"akashicVersion":"OX-AKASHIC-1","appendOnly":true,"events":[{"containsPII":false,"eventHash":"sha256:205b3a1baaaee207f82c4fcb37c2c09b9875de1e07cba9f663e7b7510070fc1a","eventType":"DNA_FORGED","lifecycleReference":"GENESIS-0003-EVENT-0001","payload":{"dnaHash":"sha256:e5064acd8eaabe263f432141933087b03df06b944897e784eb30dc2085bfce9b"},"previousEventHash":null,"publicSafe":true,"sequence":1},{"containsPII":false,"eventHash":"sha256:ee1ffea627bf4dce5c64f34767af21cac7ae6063e8446e257e813f9923176b65","eventType":"NAME_ASSIGNED","lifecycleReference":"GENESIS-0003-EVENT-0002","payload":{"canonicalName":"Korvaxion the First Ember","title":"Bearer of the Foundation Flame"},"previousEventHash":"sha256:205b3a1baaaee207f82c4fcb37c2c09b9875de1e07cba9f663e7b7510070fc1a","publicSafe":true,"sequence":2},{"containsPII":false,"eventHash":"sha256:86ff83f0849c2d5532c8b741b26f1e0ed0e707ac2e0af835a58da6dc438a5ff5","eventType":"RESONANCE_CREATED","lifecycleReference":"GENESIS-0003-EVENT-0003","payload":{"resonanceId":"OX-RES-GENESIS-0003","resonanceSignature":"sha256:cc9527fc579b8f4a20fe852ed4642b3878c705e3947038c79ff525e4b41757ec"},"previousEventHash":"sha256:ee1ffea627bf4dce5c64f34767af21cac7ae6063e8446e257e813f9923176b65","publicSafe":true,"sequence":3},{"containsPII":false,"eventHash":"sha256:6d97e4c8f4272ad81bece3b8f3084b828d1b02eab33aa989f9802b0a1aa0747b","eventType":"RESONANCE_GLYPH_MANIFESTED","lifecycleReference":"GENESIS-0003-EVENT-0004","payload":{"manifestHash":"sha256:0eaccefa28d86db1b0f8ea816dfd168495ef32a7d2878d8ae3cf34e3408dd7a3","svgHash":"sha256:a1cee733d7e538e7f1ceecdb355e1ae02c237cf13ff8ebe395bfd8deaabe805a"},"previousEventHash":"sha256:86ff83f0849c2d5532c8b741b26f1e0ed0e707ac2e0af835a58da6dc438a5ff5","publicSafe":true,"sequence":4}],"headHash":"sha256:6d97e4c8f4272ad81bece3b8f3084b828d1b02eab33aa989f9802b0a1aa0747b","tamperEvident":true,"tokenId":3},"glyph":{"geometry":{"asymmetryIndex":0,"influenceTargets":["horn rhythm","wing geometry","energy topology","cracks","engravings","architecture","lighting patterns"],"rings":2,"rotationDegrees":352,"spokes":10},"glyphSeed":5942233771283513625,"glyphVersion":"OX-RESONANCE-GLYPH-1","manifestHash":"sha256:0eaccefa28d86db1b0f8ea816dfd168495ef32a7d2878d8ae3cf34e3408dd7a3","svg":"<svg xmlns=\"http://www.w3.org/2000/svg\" viewBox=\"0 0 256 256\" fill=\"none\" stroke=\"currentColor\" stroke-width=\"3\"><circle cx=\"128\" cy=\"128\" r=\"44\"/><circle cx=\"128\" cy=\"128\" r=\"64\"/><line x1=\"128\" y1=\"128\" x2=\"128\" y2=\"24\" transform=\"rotate(352.000 128 128)\"/><line x1=\"128\" y1=\"128\" x2=\"128\" y2=\"24\" transform=\"rotate(28.000 128 128)\"/><line x1=\"128\" y1=\"128\" x2=\"128\" y2=\"24\" transform=\"rotate(64.000 128 128)\"/><line x1=\"128\" y1=\"128\" x2=\"128\" y2=\"24\" transform=\"rotate(100.000 128 128)\"/><line x1=\"128\" y1=\"128\" x2=\"128\" y2=\"24\" transform=\"rotate(136.000 128 128)\"/><line x1=\"128\" y1=\"128\" x2=\"128\" y2=\"24\" transform=\"rotate(172.000 128 128)\"/><line x1=\"128\" y1=\"128\" x2=\"128\" y2=\"24\" transform=\"rotate(208.000 128 128)\"/><line x1=\"128\" y1=\"128\" x2=\"128\" y2=\"24\" transform=\"rotate(244.000 128 128)\"/><line x1=\"128\" y1=\"128\" x2=\"128\" y2=\"24\" transform=\"rotate(280.000 128 128)\"/><line x1=\"128\" y1=\"128\" x2=\"128\" y2=\"24\" transform=\"rotate(316.000 128 128)\"/></svg>","svgHash":"sha256:a1cee733d7e538e7f1ceecdb355e1ae02c237cf13ff8ebe395bfd8deaabe805a","tokenId":3,"watermarkRequired":false},"loreVersion":"OX-GENESIS-LORE-1","packageHash":"sha256:2339eddaa869ff5eba2f5e17b944f765820660dd9a609a878c7d938fafafdbb8","resonance":{"glyphSeed":5942233771283513625,"interpretation":"Deterministic artistic and mathematical parameters; not a claim of spiritual, physical, or scientific energy.","phaseDegrees":352,"primaryFrequency":883,"pulse":3,"resonanceClass":"FORGEBOUND","resonanceId":"OX-RES-GENESIS-0003","resonanceSignature":"sha256:cc9527fc579b8f4a20fe852ed4642b3878c705e3947038c79ff525e4b41757ec","resonanceVersion":"OX-RESONANCE-1","secondaryFrequency":819,"spectrum":["cold-cyan","dark-forged-metal","ember-red"]},"tokenId":3}